{
  "schemaVersion": "1.0",
  "experimentId": "INFOAPEX-P2-A",
  "sourceBaselineCommit": "df1a0462ce85390b33e0674d538b7f8e2ee12134",
  "graph06Enabled": false,
  "maximumLiveInvocations": 2,
  "providers": {
    "codex": {
      "model": "gpt-5.6-sol",
      "effort": "high",
      "cliVersion": "0.147.0"
    },
    "claude": {
      "model": "sonnet",
      "effort": null,
      "cliVersion": "2.1.235"
    }
  },
  "tasks": [
    {
      "taskId": "P2A-CODEX-SMOKE",
      "engine": "codex",
      "goal": "Create src/p2-a-codex.txt containing exactly P2-A CODEX SMOKE followed by a newline.",
      "goalSha256": "f98faf7286ad5e0c9a9476e7e4b5ae22400175479e6e2866a80ffd3fdd197a6b",
      "expectedPath": "src/p2-a-codex.txt",
      "expectedContent": "P2-A CODEX SMOKE\n"
    },
    {
      "taskId": "P2A-CLAUDE-SMOKE",
      "engine": "claude",
      "goal": "Create src/p2-a-claude.txt containing exactly P2-A CLAUDE SMOKE followed by a newline.",
      "goalSha256": "78f4bb4ba5d01d0e3b84521c89f93cbdeef94a262e5646f4ab8831943718b907",
      "expectedPath": "src/p2-a-claude.txt",
      "expectedContent": "P2-A CLAUDE SMOKE\n"
    }
  ]
}
